{
  "agent_status": "done",
  "diagnosis": [
    "The solution fields are sufficiently clear.",
    "Scope limits are explicit."
  ],
  "updated_solution_definition": {
    "solution_summary": "A guided intake assistant collects triage context and prepares structured handoff notes.",
    "target_user": "Admission nursing staff",
    "how_it_works": "The assistant asks bounded questions, records answers, and creates a structured summary for review.",
    "workflow_change": "Nurses use a guided intake flow before manual triage review instead of starting from free-text notes.",
    "current_solutions": "Current work relies on manual notes and static protocol sheets.",
    "value_differential": "The proposal gives a more consistent intake summary without replacing clinical judgement.",
    "scope_limits": "The first version covers adult emergency intake notes and excludes diagnosis or prioritization decisions.",
    "assumptions": [
      "Nursing staff can answer the guided questions during intake."
    ],
    "ambiguities_remaining": []
  },
  "next_question": "",
  "completion_reason": "solution sufficiently defined"
}
